{
  "schema_version": "1.0",
  "category": "sudoku-puzzles",
  "generated_at": "2026-07-31T12:26:05Z",
  "evidence_mode": "mixed",
  "category_overview": {
    "trending_types": [
      {
        "type": "Classic 9x9 (difficulty-tiered: easy/medium/hard/expert)",
        "confidence": "high",
        "evidence_ref": "F-001"
      },
      {
        "type": "Large-print / 'Bold and Easy' for seniors",
        "confidence": "high",
        "evidence_ref": "F-024"
      },
      {
        "type": "Sudoku Variations (killer, samurai, jigsaw)",
        "confidence": "med",
        "evidence_ref": "F-018"
      },
      {
        "type": "Kids mini-grid (4x4 / 6x6 stepping to 9x9)",
        "confidence": "med",
        "evidence_ref": "F-019"
      },
      {
        "type": "Volume-anchored (1000 puzzles)",
        "confidence": "med",
        "evidence_ref": "F-020"
      }
    ],
    "audiences": [
      "adult-general (primary, ~35-70; head term crowded)",
      "senior-large-print (rising demand, essential large-print)",
      "kids-6-10 (dominant kids framing) & kids-4-8 (mini-grid)",
      "tween-8-12",
      "teen-13-17 (real but small niche, F-025)"
    ],
    "categories": [
      {
        "bisac_or_browse": "Amazon browse: Books > Humor & Entertainment > Puzzles & Games > Sudoku",
        "evidence_ref": "F-013"
      },
      {
        "bisac_or_browse": "BISAC Games & Activities > Puzzles family (exact code to confirm at listing)",
        "evidence_ref": "F-013"
      },
      {
        "bisac_or_browse": "Etsy: Digital Download > Puzzles / Puzzle Book / Large Print Puzzle > Sudoku",
        "evidence_ref": "F-022"
      }
    ],
    "seo": {
      "title_patterns": [
        "[Difficulty] Sudoku for [Audience]: [N] Puzzles to [Benefit]",
        "Large Print Sudoku Puzzle Book for Seniors: [N] [Difficulty] Puzzles with Solutions",
        "Sudoku for Beginners: [N] Step-by-Step Puzzles with Tips & Full Solutions",
        "Daily Sudoku Puzzle Book: [N] Puzzles for Brain Health & [Benefit]",
        "[N] Sudoku Puzzles: [Range] with Solutions"
      ],
      "keyword_ideas": [
        "sudoku puzzle book for adults",
        "large print sudoku for seniors",
        "easy sudoku for beginners",
        "hard sudoku puzzles",
        "expert level sudoku",
        "brain games for seniors",
        "daily sudoku puzzle book",
        "medium difficulty sudoku book",
        "sudoku with solutions",
        "1000 sudoku puzzles book"
      ],
      "evidence_ref": "F-011"
    },
    "size_norms": {
      "trim": [
        "6x9",
        "8.5x11"
      ],
      "page_band": [
        100,
        200
      ],
      "evidence_ref": "F-007"
    }
  },
  "products": {
    "adult-easy": {
      "product_id": "adult-easy",
      "status": "candidate",
      "priority": 1,
      "confidence": "high",
      "working_title": "Easy Sudoku for Adults: Relaxing Puzzles with Full Solutions",
      "audience": "adult-general",
      "product_type": "puzzle-book",
      "formats": [
        "paperback",
        "digital-pdf"
      ],
      "trim_size_preference": "6x9",
      "difficulty": {
        "tier": "easy",
        "spread": "single-tier easy"
      },
      "puzzle_count_target": 200,
      "page_budget_target": 150,
      "positioning": "Entry point of a difficulty-tiered series; low-competition tail via 'easy/relaxing' framing.",
      "interior_style_notes": "Advisory: clean high-contrast grids, back-only answer key with numbered puzzles.",
      "seo": {
        "title_pattern": "Easy Sudoku for Adults: [N] Puzzles to [Benefit]",
        "keyword_ideas": [
          "easy sudoku for beginners",
          "sudoku puzzle book for adults",
          "sudoku with solutions"
        ],
        "categories": [
          "Humor & Entertainment > Puzzles & Games > Sudoku"
        ]
      },
      "series_grouping": {
        "is_series": true,
        "series_slug": "adult-difficulty-tier",
        "position": 1,
        "set": "Easy/Medium/Hard/Expert"
      },
      "evidence_refs": [
        "F-001",
        "F-009",
        "F-011",
        "F-012",
        "F-007",
        "F-016"
      ],
      "open_questions": [
        "Confirm live BSR/price via manual Amazon tier before committing price band."
      ]
    },
    "senior-large-print-easy": {
      "product_id": "senior-large-print-easy",
      "status": "promoted",
      "priority": 1,
      "confidence": "high",
      "working_title": "Large Print Sudoku for Seniors: Easy Puzzles with Solutions",
      "audience": "senior-large-print",
      "product_type": "puzzle-book",
      "formats": [
        "paperback"
      ],
      "trim_size_preference": "8.5x11",
      "difficulty": {
        "tier": "easy",
        "spread": "easy, forgiving"
      },
      "puzzle_count_target": 100,
      "page_budget_target": 110,
      "positioning": "High-contrast, oversized-grid large print; senior-care bulk-purchase demand cited.",
      "interior_style_notes": "Advisory: senior-large-print band requires high contrast and oversized grids per house rules.",
      "seo": {
        "title_pattern": "Large Print Sudoku Puzzle Book for Seniors: [N] Puzzles with Solutions",
        "keyword_ideas": [
          "large print sudoku for seniors",
          "brain games for seniors",
          "sudoku with solutions"
        ],
        "categories": [
          "Humor & Entertainment > Puzzles & Games > Sudoku"
        ]
      },
      "series_grouping": {
        "is_series": true,
        "series_slug": "senior-large-print",
        "position": 1,
        "set": "Easy/Medium large print"
      },
      "evidence_refs": [
        "F-002",
        "F-005",
        "F-006",
        "F-007",
        "F-011",
        "F-012",
        "F-017",
        "F-024"
      ],
      "open_questions": [
        "Confirm accessibility gate contrast/type-size targets at project init."
      ],
      "promoted_project_id": "clr-2026-large-print-sudoku-for-seniors-easy-puzzles-with"
    },
    "adult-medium": {
      "product_id": "adult-medium",
      "status": "candidate",
      "priority": 2,
      "confidence": "high",
      "working_title": "Medium Sudoku for Adults: [N] Puzzles with Full Solutions",
      "audience": "adult-general",
      "product_type": "puzzle-book",
      "formats": [
        "paperback",
        "digital-pdf"
      ],
      "trim_size_preference": "6x9",
      "difficulty": {
        "tier": "medium",
        "spread": "single-tier medium"
      },
      "puzzle_count_target": 200,
      "page_budget_target": 150,
      "positioning": "Second book of the difficulty-tiered series; drives repeat purchase from same buyer.",
      "seo": {
        "title_pattern": "Medium Sudoku for Adults: [N] Puzzles with Solutions",
        "keyword_ideas": [
          "medium difficulty sudoku book",
          "sudoku puzzle book for adults"
        ],
        "categories": [
          "Humor & Entertainment > Puzzles & Games > Sudoku"
        ]
      },
      "series_grouping": {
        "is_series": true,
        "series_slug": "adult-difficulty-tier",
        "position": 2,
        "set": "Easy/Medium/Hard/Expert"
      },
      "evidence_refs": [
        "F-009",
        "F-011",
        "F-012",
        "F-016"
      ],
      "open_questions": []
    },
    "adult-hard": {
      "product_id": "adult-hard",
      "status": "candidate",
      "priority": 2,
      "confidence": "high",
      "working_title": "Hard Sudoku Puzzles for Adults: [N] Challenging Grids with Solutions",
      "audience": "adult-general",
      "product_type": "puzzle-book",
      "formats": [
        "paperback",
        "digital-pdf"
      ],
      "trim_size_preference": "6x9",
      "difficulty": {
        "tier": "hard",
        "spread": "single-tier hard"
      },
      "puzzle_count_target": 200,
      "page_budget_target": 150,
      "positioning": "Advanced solvers blow through easy/medium volumes; higher engagement and review velocity.",
      "seo": {
        "title_pattern": "Hard Sudoku Puzzles: [N] Grids",
        "keyword_ideas": [
          "hard sudoku puzzles",
          "sudoku with solutions"
        ],
        "categories": [
          "Humor & Entertainment > Puzzles & Games > Sudoku"
        ]
      },
      "series_grouping": {
        "is_series": true,
        "series_slug": "adult-difficulty-tier",
        "position": 3,
        "set": "Easy/Medium/Hard/Expert"
      },
      "evidence_refs": [
        "F-009",
        "F-011",
        "F-016"
      ],
      "open_questions": []
    },
    "beginners-guided": {
      "product_id": "beginners-guided",
      "status": "candidate",
      "priority": 2,
      "confidence": "high",
      "working_title": "Sudoku for Beginners: Step-by-Step Puzzles with Tips and Full Solutions",
      "audience": "adult-general",
      "product_type": "puzzle-book",
      "formats": [
        "paperback",
        "digital-pdf"
      ],
      "trim_size_preference": "6x9",
      "difficulty": {
        "tier": "easy",
        "spread": "how-to + graded easy"
      },
      "puzzle_count_target": 150,
      "page_budget_target": 140,
      "positioning": "Instructional on-ramp; captures 'sudoku for beginners' + how-to intent that pure puzzle books miss.",
      "interior_style_notes": "Advisory: front-matter technique pages (scanning, pencil marks) at adult-general reading level; back-only solutions.",
      "seo": {
        "title_pattern": "Sudoku for Beginners: [N] Step-by-Step Puzzles with Tips & Full Solutions",
        "keyword_ideas": [
          "easy sudoku for beginners",
          "sudoku with solutions",
          "sudoku puzzle book for adults"
        ],
        "categories": [
          "Humor & Entertainment > Puzzles & Games > Sudoku"
        ]
      },
      "series_grouping": {
        "is_series": false
      },
      "evidence_refs": [
        "F-011",
        "F-012",
        "F-014",
        "F-016"
      ],